{
  "schema_version": "1.0",
  "event_id": "44444444-4444-4444-8444-444444444444",
  "occurred_at": "2026-07-30T12:00:00Z",
  "event_type": "evaluated",
  "operation_id": "11111111-1111-4111-8111-111111111111",
  "decision_id": "22222222-2222-4222-8222-222222222222",
  "correlation_id": "correlation.example",
  "actor_ref": { "algorithm": "sha256", "value": "aaaaaaaaaaaaaaaaaaaaaaaaaaaaaaaaaaaaaaaaaaaaaaaaaaaaaaaaaaaaaaaa" },
  "session_ref": { "algorithm": "sha256", "value": "bbbbbbbbbbbbbbbbbbbbbbbbbbbbbbbbbbbbbbbbbbbbbbbbbbbbbbbbbbbbbbbb" },
  "source": { "host": "codex", "protocol": "pre_tool_use", "adapter_id": "ofw.codex", "tool_name": "Bash" },
  "operation": { "kind": "git.status", "effect": "read", "digest": { "algorithm": "sha256", "value": "cccccccccccccccccccccccccccccccccccccccccccccccccccccccccccccccc" } },
  "target_refs": [{ "algorithm": "sha256", "value": "dddddddddddddddddddddddddddddddddddddddddddddddddddddddddddddddd" }],
  "environment": "local",
  "outcome": "allow",
  "policy_snapshot_digest": { "algorithm": "sha256", "value": "eeeeeeeeeeeeeeeeeeeeeeeeeeeeeeeeeeeeeeeeeeeeeeeeeeeeeeeeeeeeeeee" },
  "determining_rule_refs": ["builtin/builtin.safe-reads/1.0.0/git.status"],
  "health": { "enforcement": "healthy", "audit": "healthy", "coverage": "unknown" },
  "redaction": { "profile_id": "default", "profile_version": "1.0.0", "redacted_field_count": 0, "canary_scan": "passed" }
}
